{
  "schema_version": 1,
  "visual_protocol": 1,
  "id": "novation/launchpad/pro-mk1",
  "name": "Novation Launchpad Pro Mk1",
  "manufacturer": "Novation",
  "family": "Launchpad",
  "model": "Pro Mk1",
  "status": "supported",
  "driver": "midi.palette-grid",
  "ports": {
    "input": [
      "^Launchpad Pro:Launchpad Pro Standalone Port",
      "^Launchpad Pro Standalone Port"
    ],
    "output": [
      "^Launchpad Pro:Launchpad Pro Standalone Port",
      "^Launchpad Pro Standalone Port"
    ]
  },
  "grid": {
    "kind": "note",
    "channel": 0,
    "rows": [
      [81, 82, 83, 84, 85, 86, 87, 88],
      [71, 72, 73, 74, 75, 76, 77, 78],
      [61, 62, 63, 64, 65, 66, 67, 68],
      [51, 52, 53, 54, 55, 56, 57, 58],
      [41, 42, 43, 44, 45, 46, 47, 48],
      [31, 32, 33, 34, 35, 36, 37, 38],
      [21, 22, 23, 24, 25, 26, 27, 28],
      [11, 12, 13, 14, 15, 16, 17, 18]
    ]
  },
  "surface": {
    "state_region": {"x": 0, "y": 0, "width": 7, "height": 8},
    "showcase": {
      "top": [
        {"kind": "cc", "number": 91},
        {"kind": "cc", "number": 92},
        {"kind": "cc", "number": 93},
        {"kind": "cc", "number": 94},
        {"kind": "cc", "number": 95},
        {"kind": "cc", "number": 96},
        {"kind": "cc", "number": 97},
        {"kind": "cc", "number": 98}
      ],
      "right": [
        {"kind": "cc", "number": 89},
        {"kind": "cc", "number": 79},
        {"kind": "cc", "number": 69},
        {"kind": "cc", "number": 59},
        {"kind": "cc", "number": 49},
        {"kind": "cc", "number": 39},
        {"kind": "cc", "number": 29},
        {"kind": "cc", "number": 19}
      ]
    },
    "actions": {
      "approve": {"kind": "cc", "number": 91},
      "reject": {"kind": "cc", "number": 92},
      "retry": {"kind": "cc", "number": 97},
      "stop": {"kind": "cc", "number": 98}
    },
    "agent_selectors": [
      {"kind": "cc", "number": 89},
      {"kind": "cc", "number": 79},
      {"kind": "cc", "number": 69},
      {"kind": "cc", "number": 59},
      {"kind": "cc", "number": 49},
      {"kind": "cc", "number": 39},
      {"kind": "cc", "number": 29},
      {"kind": "cc", "number": 19}
    ],
    "agent_statuses": [
      {"kind": "note", "number": 88},
      {"kind": "note", "number": 78},
      {"kind": "note", "number": 68},
      {"kind": "note", "number": 58},
      {"kind": "note", "number": 48},
      {"kind": "note", "number": 38},
      {"kind": "note", "number": 28},
      {"kind": "note", "number": 18}
    ],
    "indicators": {
      "overflow": {"kind": "cc", "number": 95}
    }
  },
  "palette": {
    "off": 0,
    "idle": 1,
    "activity": 3,
    "states": {
      "idle": {"primary": 1, "summary": 1},
      "running": {"primary": 45, "summary": 47},
      "waiting_for_reply": {"primary": 3, "summary": 1},
      "user_typing": {"primary": 37, "summary": 39},
      "waiting_for_approval": {"primary": 9, "summary": 11},
      "success": {"primary": 21, "summary": 23},
      "error": {"primary": 5, "summary": 7},
      "cancelled": {"primary": 2, "summary": 2}
    },
    "actions": {
      "approve": {"enabled": 21},
      "reject": {"enabled": 5},
      "retry": {"enabled": 45},
      "stop": {"enabled": 5}
    },
    "system": {"overflow": 9}
  },
  "accents": [
    {"name": "cyan", "selected": 37, "unselected": 39},
    {"name": "magenta", "selected": 53, "unselected": 55},
    {"name": "lime", "selected": 17, "unselected": 19},
    {"name": "orange", "selected": 9, "unselected": 11},
    {"name": "violet", "selected": 49, "unselected": 51},
    {"name": "teal", "selected": 29, "unselected": 31},
    {"name": "rose", "selected": 57, "unselected": 59},
    {"name": "sky", "selected": 41, "unselected": 43}
  ],
  "conformance": ["core-state", "multi-agent", "actions"],
  "messages": {
    "startup": [
      {"type": "sysex", "data": [0, 32, 41, 2, 16, 33, 1]},
      {"type": "sysex", "data": [0, 32, 41, 2, 16, 44, 3]}
    ],
    "clear": [],
    "shutdown": [
      {"type": "sysex", "data": [0, 32, 41, 2, 16, 34, 0]},
      {"type": "sysex", "data": [0, 32, 41, 2, 16, 33, 0]}
    ]
  },
  "capabilities": {
    "text_scroll": true,
    "show_rgb": {
      "sysex_prefix": [0, 32, 41, 2, 16, 11],
      "channel_max": 63,
      "batch_size": 78
    }
  }
}
